{
  "chunk_id": "nexus-sessions@1.0:retrieval_policy",
  "chunk_type": "retrieval_policy",
  "content_sha256": "687706db599d5c12e599ea726dcc82ee0f72dd020e913401fc19d390614864fa",
  "part": 1,
  "payload": {
    "min_novelty": 0.55,
    "notes": "Defaults per MEMORY_GRAPH_STANDARDS \u00a76A retrieval_policy.",
    "path_prune_alpha": 0.8,
    "path_threshold": 0.2
  },
  "scope": "session",
  "set_id": "nexus-sessions",
  "set_version": "1.0",
  "source": "agent:roo;mode:Physicist;workflow:VDM_Nexus_KG-Lite;repo_head:500d987bddca793bd3986ef6b9a5cf8cab3da467",
  "tags": [
    "kg-lite",
    "retrieval_policy",
    "nexus",
    "session"
  ],
  "total_parts": 1,
  "updated": "2025-10-27T19:36:28Z"
}
