{
  "chunk_id": "nexus-sessions@1.0:meta",
  "chunk_type": "meta",
  "content_sha256": "c6ca5409537f090365a59efb0e497d53c97bdb864baedd239e14a893b6d7c01b",
  "part": 1,
  "payload": {
    "agent": "roo",
    "dataset": "nexus-sessions",
    "links": [
      "memory-bank/MEMORY_GRAPH_STANDARDS.md#6a-kg-lite-chunk-envelope-and-branching"
    ],
    "notes": "Session dataset for logging Nexus workflow context using KG-Lite envelopes.",
    "policy": "external-agent-only; no in-repo memory impl inside VDM_Nexus",
    "role": "Physicist",
    "session_utc": "2025-10-27T19:36:28Z",
    "version": "1.0"
  },
  "scope": "session",
  "set_id": "nexus-sessions",
  "set_version": "1.0",
  "source": "agent:roo;mode:Physicist;workflow:VDM_Nexus_KG-Lite;repo_head:500d987bddca793bd3986ef6b9a5cf8cab3da467",
  "tags": [
    "kg-lite",
    "meta",
    "nexus",
    "session"
  ],
  "total_parts": 1,
  "updated": "2025-10-27T19:36:28Z"
}
